{
  "evaluationRequestId": "45345dea-8054-5f80-ac97-7d471d9c88b8",
  "applicationId": "52de19d2-1bea-5fd3-9685-868e1a7207b7",
  "applicationRevision": 1,
  "verificationId": "f2e0a9b4-794d-5340-9b34-5a1fd1153469",
  "asOfDate": "2026-10-13",
  "authorisedRetrievalReference": "demo-authorised-source-104"
}
